### ISSUE TITLE
geneve options not supported?

### ISSUE THREAD

**Issue by Nieuwejaar** [oxidecomputer/overwatch#14]
This packet:
```
0000   a8 40 25 04 02 df a8 40 25 05 06 13 86 dd 60 00
0010   00 00 00 5e 11 fe 00 00 00 00 00 00 00 00 00 00
0020   00 00 00 00 00 00 fd 00 11 22 33 44 01 02 00 00
0030   00 00 00 00 00 01 17 c1 17 c1 00 5e 85 27 01 00
0040   65 58 00 00 64 00 01 29 00 00 a8 40 25 ff f5 4a
0050   00 00 00 00 00 00 08 00 45 48 00 3c 28 2f 40 00
0060   3e 06 85 86 ac 14 1a 5f ac 14 1c 37 99 68 00 16
0070   c5 39 7b 8f 00 00 00 00 a0 02 fa f0 00 6b 00 00
0080   02 04 05 b4 04 02 08 0a 09 28 da 7b 00 00 00 00
0090   01 03 03 01
```
is parsed by `wireshark` as:
```
Frame 1: 148 bytes on wire (1184 bits), 148 bytes captured (1184 bits)
Ethernet II, Src: OxideCompute_05:06:13 (a8:40:25:05:06:13), Dst: OxideCompute_04:02:df (a8:40:25:04:02:df)
    Destination: OxideCompute_04:02:df (a8:40:25:04:02:df)
    Source: OxideCompute_05:06:13 (a8:40:25:05:06:13)
    Type: IPv6 (0x86dd)
    [Stream index: 0]
Internet Protocol Version 6, Src: ::, Dst: fd00:1122:3344:102::1
User Datagram Protocol, Src Port: 6081, Dst Port: 6081
Generic Network Virtualization Encapsulation, VNI: 0x000064
    Version: 0
    Length: 4 bytes
    Flags: 0x00
    Protocol Type: Transparent Ethernet bridging (0x6558)
    Virtual Network Identifier (VNI): 0x000064 (100)
    Options: (4 bytes)
Ethernet II, Src: 00:00:00_00:00:00 (00:00:00:00:00:00), Dst: OxideCompute_ff:f5:4a (a8:40:25:ff:f5:4a)
    Destination: OxideCompute_ff:f5:4a (a8:40:25:ff:f5:4a)
    Source: 00:00:00_00:00:00 (00:00:00:00:00:00)
    Type: IPv4 (0x0800)
    [Stream index: 1]
Internet Protocol Version 4, Src: 172.20.26.95, Dst: 172.20.28.55
Transmission Control Protocol, Src Port: 39272, Dst Port: 22, Seq: 0, Len: 0
```
`overwatch` gets as far as parsing the body of the `geneve` header, but then falls down:
```
=====|
Eth  | A8:40:25:05:06:13 > A8:40:25:04:02:DF et IPv6 len 148
Ip6  | :: > fd00:1122:3344:102::1 tc 0 fl 0 len 94 ttl 254 proto Udp
UDP  | 6081 > 6081 len 94 chk 34087
Gnv  | 100 ver 0 olen 1 ctrl false crit false proto Ethernet
-----|
Eth  | 25:FF:F5:4A:00:00 > 01:29:00:00:A8:40 et 0x0000
BRM42220007
```
From the inner mac address, it looks like it may have ignored the 4 `Options` bytes in the `geneve` header and started processing the encapsulated packet at the wrong offset.

This also appears to cause `overwatch` to not report snooped packets with `geneve` options.

A `tcpdump` snippet on `madrid` looks like:
```
BRM42220007 # ./tcpdump -ni cxgbe1 port 6081 | sed "s/.*Geneve//"
tcpdump: verbose output suppressed, use -v[v]... for full protocol decode
listening on cxgbe1, link-type EN10MB (Ethernet), snapshot length 262144 bytes
, Flags [none], vni 0x63: IP 172.20.28.5.32727 > 172.20.0.5.123: NTPv4, Client, length 48
, Flags [none], vni 0x64, options [4 bytes]: IP 172.20.0.5.123 > 172.20.28.5.32727: NTPv4, Server, length 48
, Flags [none], vni 0x64, options [4 bytes]: IP 1.1.1.1.53 > 172.20.28.5.32703: 47438 1/1/0 CNAME catacomb.eng.oxide.co
mputer. (110)
, Flags [none], vni 0x64, options [4 bytes]: IP 1.1.1.1.53 > 172.20.28.5.32766: 25778 2/0/0 CNAME catacomb.eng.oxide.co
mputer., A 172.20.0.5 (79)
, Flags [none], vni 0x63: IP 172.20.28.5.32751 > 172.20.0.5.123: NTPv4, Client, length 48
, Flags [none], vni 0x64, options [4 bytes]: IP 172.20.0.5.123 > 172.20.28.5.32751: NTPv4, Server, length 48
, Flags [none], vni 0x64, options [4 bytes]: IP 172.20.0.5.123 > 172.20.28.5.32715: NTPv4, Server, length 48
```
We can see a mixture of packets both with and without geneve options.

A similar snippet from `overwatch` shows only those packets without options:
```
BRM42220007 # overwatch snoop --alp geneve cxgbe1 | grep Gnv
Gnv  | 99 ver 0 olen 0 ctrl false crit false proto Ethernet
Gnv  | 99 ver 0 olen 0 ctrl false crit false proto Ethernet
Gnv  | 99 ver 0 olen 0 ctrl false crit false proto Ethernet
Gnv  | 99 ver 0 olen 0 ctrl false crit false proto Ethernet
Gnv  | 99 ver 0 olen 0 ctrl false crit false proto Ethernet
Gnv  | 99 ver 0 olen 0 ctrl false crit false proto Ethernet
Gnv  | 99 ver 0 olen 0 ctrl false crit false proto Ethernet
Gnv  | 99 ver 0 olen 0 ctrl false crit false proto Ethernet
Gnv  | 99 ver 0 olen 0 ctrl false crit false proto Ethernet
```
